{
  "run_id": "95859d6c-6470-4c59-bd4f-ae6264b4edec",
  "run_type": "experiment",
  "status": "failed",
  "started_at": "2026-04-08T13:08:42.060005+00:00",
  "stages": [
    "judge_generation",
    "judge_retrieval",
    "build_request_summary"
  ],
  "postgres_url": "postgres://postgres:postgres@127.0.0.1:5432/rag_eval",
  "chunks_path": "Evidence/parsing/understanding_distributed_systems/chunks/fixed_chunks.jsonl",
  "tracing_endpoint": "http://localhost:4317",
  "judge_provider": "together",
  "judge_base_url": "https://api.together.xyz/v1",
  "judge_model": "openai/gpt-oss-20b",
  "generation_suite_versions": {
    "answer_completeness": "v1",
    "groundedness": "v1",
    "answer_relevance": "v1",
    "correct_refusal": "v1"
  },
  "retrieval_suite_versions": {
    "retrieval_relevance": "v1"
  },
  "request_count": 0,
  "run_scope_request_ids": [],
  "completed_at": "2026-04-08T13:08:42.227176+00:00",
  "last_error": "no request captures found for run scope"
}
