{
  "run_id": "2d6399f1-a2f4-4378-98f3-a15a2901b3da",
  "run_type": "experiment",
  "status": "completed",
  "started_at": "2026-04-10T14:56:47.298559+00:00",
  "stages": [
    "judge_generation",
    "judge_retrieval",
    "build_request_summary"
  ],
  "postgres_url": "postgres://postgres:postgres@localhost:5432/rag_eval",
  "chunks_path": "/home/olesia/code/prompt_gen_proj/Evidence/parsing/understanding_distributed_systems/chunks/fixed_chunks.jsonl",
  "tracing_endpoint": "http://localhost:4317",
  "judge_provider": "together",
  "judge_base_url": "https://api.together.xyz/v1",
  "judge_model": "openai/gpt-oss-20b",
  "generation_suite_versions": {
    "answer_completeness": "v1",
    "groundedness": "v1",
    "answer_relevance": "v1",
    "correct_refusal": "v1"
  },
  "retrieval_suite_versions": {
    "retrieval_relevance": "v1"
  },
  "request_count": 20,
  "run_scope_request_ids": [
    "26a08482-0bb8-4aee-bbff-307dbb33389a",
    "4f606871-e3c1-4ef5-85cb-71a16e67489a",
    "506047d2-ec57-4be5-be82-9d1a9fa9e153",
    "aecf8079-a907-430b-8f35-c9481febb357",
    "7dbb64db-e88e-462f-bba1-04c5178cc673",
    "4984adbd-187e-41bc-92ec-4f66e8b26b9b",
    "9ef86f43-8d6e-454e-9bb7-9dd39b0b43e5",
    "4632c001-ff26-4bc4-8b7c-b97aeabf125f",
    "9946cb35-88b4-4615-8cc8-2265b4c48c2d",
    "3d021290-efc0-48f2-a036-5650f0053fdb",
    "48b51a33-d06b-4323-b401-14dd5652ea0c",
    "9887d7ac-b304-47b2-8b41-b4984418924a",
    "f2bf3ebb-752e-4232-a2b4-a3e58198f9ef",
    "d5e14976-6613-4f5e-a10a-d1ff21ab3a1e",
    "7227400a-6dd0-407c-bc21-72a21db8defe",
    "d66fe6b2-d250-4c21-ac4b-ed829f109cda",
    "63a9d916-0b70-481a-b09d-dbeada266996",
    "914436b2-bf05-476d-8e18-8ebad364298b",
    "6157543d-ad01-45b1-8bec-6ac197b1b4c2",
    "d32e83e7-9a89-4a05-a40c-2eec25ef46f2"
  ],
  "retriever_kind": "Hybrid",
  "reranker_kind": "PassThrough",
  "completed_at": "2026-04-10T15:07:52.272454+00:00"
}
