{
  "run_id": "5937c9d8-2881-4517-8ece-fb95c4e50738",
  "run_type": "experiment",
  "status": "failed",
  "started_at": "2026-04-08T13:05:43.374296+00:00",
  "stages": [
    "judge_generation",
    "judge_retrieval",
    "build_request_summary"
  ],
  "postgres_url": "postgres://postgres:postgres@localhost:5432/rag_eval",
  "chunks_path": "Evidence/parsing/understanding_distributed_systems/chunks/fixed_chunks.jsonl",
  "tracing_endpoint": "http://localhost:4317",
  "judge_provider": "together",
  "judge_base_url": "https://api.together.xyz/v1",
  "judge_model": "openai/gpt-oss-20b",
  "generation_suite_versions": {
    "answer_completeness": "v1",
    "groundedness": "v1",
    "answer_relevance": "v1",
    "correct_refusal": "v1"
  },
  "retrieval_suite_versions": {
    "retrieval_relevance": "v1"
  },
  "request_count": 0,
  "run_scope_request_ids": [],
  "completed_at": "2026-04-08T13:05:50.629264+00:00",
  "last_error": "connection is bad: no error details available"
}
