{
  "run_id": "1c6b396f-974a-432b-9737-091c73eca4df",
  "run_type": "experiment",
  "status": "completed",
  "started_at": "2026-04-08T15:26:31.919614+00:00",
  "stages": [
    "judge_generation",
    "judge_retrieval",
    "build_request_summary"
  ],
  "postgres_url": "postgres://postgres:postgres@localhost:5432/rag_eval",
  "chunks_path": "/home/olesia/code/prompt_gen_proj/Evidence/parsing/understanding_distributed_systems/chunks/chunks.jsonl",
  "tracing_endpoint": "http://localhost:4317",
  "judge_provider": "together",
  "judge_base_url": "https://api.together.xyz/v1",
  "judge_model": "openai/gpt-oss-20b",
  "generation_suite_versions": {
    "answer_completeness": "v1",
    "groundedness": "v1",
    "answer_relevance": "v1",
    "correct_refusal": "v1"
  },
  "retrieval_suite_versions": {
    "retrieval_relevance": "v1"
  },
  "request_count": 5,
  "run_scope_request_ids": [
    "b4dd5a35-c219-4d73-bb73-ecaee9436766",
    "85205a54-95c7-4489-8d3b-8e2ea2783b3c",
    "aa1ee1fb-d11a-4d2a-a60a-12d0b5656f99",
    "9382024f-2d4a-4b1a-ae0e-3f9f89bf0850",
    "e7ed97c9-9920-4ed7-b93e-5163d0a95f71"
  ],
  "retriever_kind": "Hybrid",
  "reranker_kind": "PassThrough",
  "completed_at": "2026-04-08T15:30:01.858857+00:00"
}
