{
  "run_id": "70a99def-a2d5-460c-a542-9b44c9432573",
  "run_type": "experiment",
  "status": "completed",
  "started_at": "2026-04-09T18:19:29.856175+00:00",
  "stages": [
    "judge_generation",
    "judge_retrieval",
    "build_request_summary"
  ],
  "postgres_url": "postgres://postgres:postgres@localhost:5432/rag_eval",
  "chunks_path": "/home/olesia/code/prompt_gen_proj/Evidence/parsing/understanding_distributed_systems/chunks/fixed_chunks.jsonl",
  "tracing_endpoint": "http://localhost:4317",
  "judge_provider": "together",
  "judge_base_url": "https://api.together.xyz/v1",
  "judge_model": "openai/gpt-oss-20b",
  "generation_suite_versions": {
    "answer_completeness": "v1",
    "groundedness": "v1",
    "answer_relevance": "v1",
    "correct_refusal": "v1"
  },
  "retrieval_suite_versions": {
    "retrieval_relevance": "v1"
  },
  "request_count": 5,
  "run_scope_request_ids": [
    "88c55af1-3040-4725-b359-a36601df77e4",
    "ae417f15-2df4-4a32-8884-ff3e1fb99797",
    "7f5d07a5-0533-44d0-bca6-edefedd9e1a4",
    "0af71d54-0e7a-43bf-a1ff-6c982db1308d",
    "2bd527d1-ec6b-4efd-a47c-dcd0b9024cdb"
  ],
  "retriever_kind": "Hybrid",
  "reranker_kind": "CrossEncoder",
  "completed_at": "2026-04-09T18:21:51.680803+00:00"
}
